{
  "alert_type": "identity_compromise",
  "severity": "high",
  "timestamp_utc": "2026-04-25T22:35:00Z",
  "user": {
    "email": "hr-payroll@company.com",
    "user_id": "hr-003",
    "display_name": "HR Payroll",
    "department": "HR",
    "role": "Payroll Specialist",
    "privileged_access": false
  },
  "event": {
    "event_type": "password_spray_detected",
    "description": "Password spray attack detected: 6 failed attempts in 3 minutes. Sign-in blocked for 1 hour.",
    "source_ip": "185.220.101.12",
    "asn": "AS20860",
    "geo_location": "Romania | Bucharest | AS20860",
    "client_app": "Browser",
    "auth_method": "Password",
    "risk_level": "high",
    "risk_detections": ["Password spray detected", "Multiple failed attempts", "Sign-in blocked"],
    "correlation_id": "spray-hr-003",
    "session_id": "sess-spray-hr-003",
    "status": "SIGN-IN BLOCKED",
    "browser_type": "Edge on Windows 10",
    "full_user_agent": "Mozilla/5.0 (Windows NT 10.0; Win64; x64) AppleWebKit/537.36"
  },
  "technical_indicators": {
    "mfa_fatigue_count": 0,
    "legacy_protocol_used": false,
    "oauth_app_detected": false,
    "oauth_app_scopes": [],
    "hidden_inbox_rules_detected": false,
    "impossible_travel_detected": false,
    "token_replay_detected": false,
    "new_device_registration": false,
    "unfamiliar_signin_properties": true
  },
  "recommended_actions": ["Block sign-in for 1 hour", "Alert user", "Require FIDO2 for next login"],
  "investigation_links": {
    "signin_logs": "https://entra.microsoft.com/#view/signin",
    "oauth_apps": "https://entra.microsoft.com/#view/apps",
    "inbox_rules": "https://admin.exchange.microsoft.com/#/mailboxes",
    "sentinel_query": "https://portal.azure.com/#blade/sentinel",
    "user_profile": "https://entra.microsoft.com/#view/profile"
  },
  "assigned_to": {"analyst": "@spray_team", "team": "Security Operations Center"},
  "metadata": {"pipeline_version": "1.0.0", "source_system": "Sentinel", "environment": "test"}
}