{
  "alert_type": "identity_compromise",
  "severity": "high",
  "timestamp_utc": "2026-04-25T22:35:00Z",
  "user": {
    "email": "it-support@company.com",
    "user_id": "it-004",
    "display_name": "IT Support",
    "department": "IT",
    "role": "Support Engineer",
    "privileged_access": false
  },
  "event": {
    "event_type": "mfa_fatigue_detected",
    "description": "MFA fatigue attack: 4 push prompts in 5 minutes. Sign-in blocked, FIDO2 required.",
    "source_ip": "185.220.101.13",
    "asn": "AS20860",
    "geo_location": "Romania | Bucharest | AS20860",
    "client_app": "Authenticator",
    "auth_method": "MFA Push",
    "risk_level": "high",
    "risk_detections": ["MFA fatigue detected", "Multiple push prompts", "Sign-in blocked"],
    "correlation_id": "mfa-it-004",
    "session_id": "sess-mfa-it-004",
    "status": "SIGN-IN BLOCKED",
    "browser_type": "Android Authenticator",
    "full_user_agent": "Mozilla/5.0 (Linux; Android 12; Pixel 5) AppleWebKit/537.36"
  },
  "technical_indicators": {
    "mfa_fatigue_count": 4,
    "legacy_protocol_used": false,
    "oauth_app_detected": false,
    "oauth_app_scopes": [],
    "hidden_inbox_rules_detected": false,
    "impossible_travel_detected": false,
    "token_replay_detected": false,
    "new_device_registration": false,
    "unfamiliar_signin_properties": true
  },
  "recommended_actions": ["Block sign-in for 1 hour", "Alert user", "Mandate FIDO2 for next login"],
  "investigation_links": {
    "signin_logs": "https://entra.microsoft.com/#view/signin",
    "oauth_apps": "https://entra.microsoft.com/#view/apps",
    "inbox_rules": "https://admin.exchange.microsoft.com/#/mailboxes",
    "sentinel_query": "https://portal.azure.com/#blade/sentinel",
    "user_profile": "https://entra.microsoft.com/#view/profile"
  },
  "assigned_to": {"analyst": "@mfa_team", "team": "Security Operations Center"},
  "metadata": {"pipeline_version": "1.0.0", "source_system": "Sentinel", "environment": "test"}
}