{
  "alert_type": "identity_compromise",
  "severity": "high",
  "timestamp_utc": "2026-04-25T22:25:00Z",
  "user": {
    "email": "bob@company.com",
    "user_id": "bob-002",
    "display_name": "Bob Jones",
    "department": "Finance",
    "role": "Controller",
    "privileged_access": false
  },
  "event": {
    "event_type": "proxy_signin_blocked",
    "description": "Sign-in attempt from risky ASN (Fast Serv Networks, Ashburn, US) auto-blocked by policy.",
    "source_ip": "198.51.100.200",
    "asn": "AS22612",
    "geo_location": "United States | Ashburn | Fast Serv Networks",
    "client_app": "Browser",
    "auth_method": "Password",
    "risk_level": "high",
    "risk_detections": ["Risky ASN", "Proxy/Hosting Provider", "Conditional Access Blocked"],
    "correlation_id": "proxy-bob-002",
    "session_id": "sess-proxy-bob-002",
    "status": "AUTO-BLOCK TRIGGERED"
  },
  "technical_indicators": {
    "mfa_fatigue_count": 0,
    "legacy_protocol_used": false,
    "oauth_app_detected": false,
    "oauth_app_scopes": [],
    "hidden_inbox_rules_detected": false,
    "impossible_travel_detected": false,
    "token_replay_detected": false,
    "new_device_registration": false,
    "unfamiliar_signin_properties": true
  },
  "recommended_actions": ["Block user account", "Revoke all sessions", "Require FIDO2/Passkey for next login"],
  "investigation_links": {
    "signin_logs": "https://entra.microsoft.com/#view/signin",
    "oauth_apps": "https://entra.microsoft.com/#view/apps",
    "inbox_rules": "https://admin.exchange.microsoft.com/#/mailboxes",
    "sentinel_query": "https://portal.azure.com/#blade/sentinel",
    "user_profile": "https://entra.microsoft.com/#view/profile"
  },
  "assigned_to": {"analyst": "@auto_block_team", "team": "Security Operations Center"},
  "metadata": {"pipeline_version": "1.0.0", "source_system": "Sentinel", "environment": "test"}
}