{
  "alert_type": "identity_endpoint_compromise",
  "severity": "critical",
  "timestamp_utc": "2026-04-25T21:55:00Z",
  "user": {
    "email": "user2@company.com",
    "user_id": "u2-002",
    "display_name": "User Two",
    "department": "Finance",
    "role": "Accountant",
    "privileged_access": false
  },
  "event": {
    "event_type": "infostealer_malware",
    "description": "Endpoint infected with infostealer malware. Credentials and cookies exfiltrated.",
    "source_ip": "185.199.108.153",
    "asn": "AS14061",
    "geo_location": "Amsterdam, NL",
    "client_app": "Chrome",
    "auth_method": "Password",
    "risk_level": "critical",
    "risk_detections": ["Infostealer detected", "Credential theft", "Browser cookie exfiltration"],
    "correlation_id": "info-002",
    "session_id": "sess-002"
  },
  "technical_indicators": {
    "mfa_fatigue_count": 0,
    "legacy_protocol_used": false,
    "oauth_app_detected": false,
    "oauth_app_scopes": [],
    "hidden_inbox_rules_detected": false,
    "impossible_travel_detected": false,
    "token_replay_detected": false,
    "new_device_registration": true,
    "unfamiliar_signin_properties": true
  },
  "recommended_actions": ["Isolate endpoint", "Reset all credentials", "Review browser sessions"],
  "investigation_links": {
    "signin_logs": "https://entra.microsoft.com/#view/signin",
    "oauth_apps": "https://entra.microsoft.com/#view/apps",
    "inbox_rules": "https://admin.exchange.microsoft.com/#/mailboxes",
    "sentinel_query": "https://portal.azure.com/#blade/sentinel",
    "user_profile": "https://entra.microsoft.com/#view/profile"
  },
  "assigned_to": {"analyst": "@malware_team", "team": "Security Operations Center"},
  "metadata": {"pipeline_version": "1.0.0", "source_system": "Sentinel", "environment": "test"}
}