{
  "alert_type": "identity_compromise",
  "severity": "high",
  "timestamp_utc": "2026-04-25T21:57:48.437784Z",
  "user": {
    "email": "user@company.com",
    "user_id": "e4da3e09-f154-4ccd-8b42-f4bb431ed654",
    "display_name": "Test User",
    "department": "Engineering",
    "role": "Software Engineer",
    "privileged_access": false
  },
  "event": {
    "event_type": "oauth_abuse",
    "description": "User granted consent to third-party app requesting Mail.ReadWrite and offline_access scopes.",
    "source_ip": "203.0.113.50",
    "asn": "AS15169",
    "geo_location": "Mountain View, USA",
    "client_app": "OAuth App - 'CloudSync Pro'",
    "auth_method": "OAuth Consent",
    "risk_level": "high",
    "risk_detections": [
      "OAuth app with risky scopes",
      "Mail.ReadWrite permission",
      "offline_access requested",
      "Unknown publisher"
    ],
    "correlation_id": "4e35369a-fc62-4579-9b7b-7d254ac00648",
    "session_id": "session-11f6d05d"
  },
  "technical_indicators": {
    "mfa_fatigue_count": 0,
    "legacy_protocol_used": false,
    "oauth_app_detected": true,
    "oauth_app_scopes": [
      "Mail.ReadWrite",
      "offline_access",
      "Calendar.ReadWrite"
    ],
    "hidden_inbox_rules_detected": false,
    "impossible_travel_detected": false,
    "token_replay_detected": false,
    "new_device_registration": false,
    "unfamiliar_signin_properties": false
  },
  "recommended_actions": [
    "Revoke all active sessions",
    "Block the account",
    "Reset password"
  ],
  "investigation_links": {
    "signin_logs": "https://entra.microsoft.com/#view/signin",
    "oauth_apps": "https://entra.microsoft.com/#view/apps",
    "inbox_rules": "https://admin.exchange.microsoft.com/#/mailboxes",
    "sentinel_query": "https://portal.azure.com/#blade/sentinel",
    "user_profile": "https://entra.microsoft.com/#view/profile"
  },
  "assigned_to": {
    "analyst": "@test_analyst",
    "team": "Security Operations Center"
  },
  "metadata": {
    "pipeline_version": "1.0.0",
    "source_system": "Sentinel",
    "environment": "test"
  }
}
