{
  "alert_type": "identity_compromise",
  "severity": "critical",
  "timestamp_utc": "2026-04-25T21:53:25.202907Z",
  "user": {
    "email": "user@company.com",
    "user_id": "8b52340c-1eef-48d9-a4e2-dea4950efea5",
    "display_name": "Global Manager",
    "department": "Engineering",
    "role": "Software Engineer",
    "privileged_access": false
  },
  "event": {
    "event_type": "impossible_travel",
    "description": "Sign-in from Tokyo, Japan 30 minutes after login from London, UK (geographically impossible in that timeframe).",
    "source_ip": "210.201.80.10",
    "asn": "AS2914",
    "geo_location": "Tokyo, Japan",
    "client_app": "Browser",
    "auth_method": "MFA Push",
    "risk_level": "high",
    "risk_detections": [
      "Impossible travel detected",
      "Geographic inconsistency",
      "Login from 5400 miles away in 30 minutes"
    ],
    "correlation_id": "faf3b194-5ddc-4111-8aac-3c01c8be5f67",
    "session_id": "session-90a65015"
  },
  "technical_indicators": {
    "mfa_fatigue_count": 0,
    "legacy_protocol_used": false,
    "oauth_app_detected": false,
    "oauth_app_scopes": [],
    "hidden_inbox_rules_detected": false,
    "impossible_travel_detected": true,
    "token_replay_detected": false,
    "new_device_registration": false,
    "unfamiliar_signin_properties": false
  },
  "recommended_actions": [
    "Revoke all active sessions",
    "Block the account",
    "Reset password"
  ],
  "investigation_links": {
    "signin_logs": "https://entra.microsoft.com/#view/signin",
    "oauth_apps": "https://entra.microsoft.com/#view/apps",
    "inbox_rules": "https://admin.exchange.microsoft.com/#/mailboxes",
    "sentinel_query": "https://portal.azure.com/#blade/sentinel",
    "user_profile": "https://entra.microsoft.com/#view/profile"
  },
  "assigned_to": {
    "analyst": "@test_analyst",
    "team": "Security Operations Center"
  },
  "metadata": {
    "pipeline_version": "1.0.0",
    "source_system": "Sentinel",
    "environment": "test"
  }
}
