{
  "alert_type": "identity_compromise",
  "severity": "critical",
  "timestamp_utc": "2026-04-25T22:35:00Z",
  "user": {
    "email": "ceo@company.com",
    "user_id": "ceo-001",
    "display_name": "CEO, Global Ops",
    "department": "Executive",
    "role": "Chief Executive Officer",
    "privileged_access": true
  },
  "event": {
    "event_type": "password_spray_success",
    "description": "Password spray attack succeeded after 7 attempts. Session captured.",
    "source_ip": "185.220.101.10",
    "asn": "AS20860",
    "geo_location": "Romania | Bucharest | AS20860",
    "client_app": "Browser",
    "auth_method": "Password",
    "risk_level": "critical",
    "risk_detections": ["Password spray detected", "Multiple failed attempts", "Session hijack"],
    "correlation_id": "spray-ceo-001",
    "session_id": "sess-spray-ceo-001",
    "status": "SESSION CAPTURED",
    "browser_type": "Chrome on Windows 11",
    "full_user_agent": "Mozilla/5.0 (Windows NT 10.0; Win64; x64) AppleWebKit/537.36"
  },
  "technical_indicators": {
    "mfa_fatigue_count": 0,
    "legacy_protocol_used": false,
    "oauth_app_detected": false,
    "oauth_app_scopes": [],
    "hidden_inbox_rules_detected": false,
    "impossible_travel_detected": false,
    "token_replay_detected": true,
    "new_device_registration": true,
    "unfamiliar_signin_properties": true
  },
  "recommended_actions": ["Block sign-in for 1 hour", "Revoke all sessions", "Require FIDO2 for next login"],
  "investigation_links": {
    "signin_logs": "https://entra.microsoft.com/#view/signin",
    "oauth_apps": "https://entra.microsoft.com/#view/apps",
    "inbox_rules": "https://admin.exchange.microsoft.com/#/mailboxes",
    "sentinel_query": "https://portal.azure.com/#blade/sentinel",
    "user_profile": "https://entra.microsoft.com/#view/profile"
  },
  "assigned_to": {"analyst": "@spray_team", "team": "Security Operations Center"},
  "metadata": {"pipeline_version": "1.0.0", "source_system": "Sentinel", "environment": "test"}
}