{
  "alert_type": "identity_compromise",
  "severity": "high",
  "timestamp_utc": "2026-04-25T22:15:00Z",
  "user": {
    "email": "bob@company.com",
    "user_id": "bob-002",
    "display_name": "Bob Jones",
    "department": "Finance",
    "role": "Controller",
    "privileged_access": false
  },
  "event": {
    "event_type": "hidden_inbox_rules",
    "description": "Hidden inbox rules detected: auto-forward to external address, suspicious filters applied.",
    "source_ip": "185.199.109.153",
    "asn": "AS14061",
    "geo_location": "Amsterdam, NL",
    "client_app": "Outlook",
    "auth_method": "Password",
    "risk_level": "high",
    "risk_detections": ["Hidden inbox rules", "Auto-forward enabled", "Suspicious filters"],
    "correlation_id": "inbox-bob-002",
    "session_id": "sess-inbox-bob-002"
  },
  "technical_indicators": {
    "mfa_fatigue_count": 0,
    "legacy_protocol_used": false,
    "oauth_app_detected": false,
    "oauth_app_scopes": [],
    "hidden_inbox_rules_detected": true,
    "impossible_travel_detected": false,
    "token_replay_detected": false,
    "new_device_registration": false,
    "unfamiliar_signin_properties": true
  },
  "recommended_actions": ["Remove hidden rules", "Reset password", "Review mailbox audit logs"],
  "investigation_links": {
    "signin_logs": "https://entra.microsoft.com/#view/signin",
    "oauth_apps": "https://entra.microsoft.com/#view/apps",
    "inbox_rules": "https://admin.exchange.microsoft.com/#/mailboxes",
    "sentinel_query": "https://portal.azure.com/#blade/sentinel",
    "user_profile": "https://entra.microsoft.com/#view/profile"
  },
  "assigned_to": {"analyst": "@mail_team", "team": "Security Operations Center"},
  "metadata": {"pipeline_version": "1.0.0", "source_system": "Sentinel", "environment": "test"}
}